{
  "workflow_version": "1.0.0",
  "project_name": "dragon-mafia-paranormal-v2",
  "current_step": "7",
  "last_updated": "2025-11-22T21:24:00Z",
  "steps": {
    "1": {
      "name": "NPE Extraction",
      "status": "completed",
      "started_at": "2025-11-22T14:00:00Z",
      "completed_at": "2025-11-22T14:15:00Z",
      "outputs_generated": ["outputs/npe.md"]
    },
    "2": {
      "name": "Dramatic Spine Extraction",
      "status": "completed",
      "started_at": "2025-11-22T15:00:00Z",
      "completed_at": "2025-11-22T15:18:00Z",
      "outputs_generated": ["outputs/dramatic_spine.md"]
    },
    "3": {
      "name": "Theme Extraction",
      "status": "completed",
      "started_at": "2025-11-22T16:00:00Z",
      "completed_at": "2025-11-22T16:15:00Z",
      "outputs_generated": ["outputs/themes.md"]
    },
    "4": {
      "name": "Character Development",
      "status": "completed",
      "started_at": "2025-11-22T17:00:00Z",
      "completed_at": "2025-11-22T18:30:00Z",
      "outputs_generated": [
        "outputs/character_Cassia_Nightshade.md",
        "outputs/character_Draven_Ashford.md",
        "outputs/character_Elara_Whisperwind.md",
        "outputs/character_Isla_Thorn.md",
        "outputs/character_Kai_Thornhart.md",
        "outputs/character_Mira_Chen.md",
        "outputs/character_Theron_Ashclaw.md"
      ]
    },
    "5": {
      "name": "World Constraints Extraction",
      "status": "completed",
      "started_at": "2025-11-22T19:00:00Z",
      "completed_at": "2025-11-22T19:30:00Z",
      "outputs_generated": ["outputs/world_constraints.md"]
    },
    "6": {
      "name": "Relationship Mapping",
      "status": "completed",
      "started_at": "2025-11-22T20:00:00Z",
      "completed_at": "2025-11-22T21:24:00Z",
      "outputs_generated": ["outputs/relationship_mapping.md"]
    },
    "7": {
      "name": "Relationship Architecture",
      "status": "pending"
    },
    "8": {
      "name": "Premise Refinement",
      "status": "pending"
    },
    "9": {
      "name": "Story Outline",
      "status": "pending"
    },
    "10": {
      "name": "NPE Inspection",
      "status": "pending"
    },
    "11": {
      "name": "Outline Rewrite",
      "status": "pending"
    }
  }
}
