{
  "workflow_version": "1.0.0",
  "project_name": "dragon-mafia-paranormal-v1",
  "current_step": "5",
  "last_updated": "2025-11-22T18:45:00Z",
  "steps": {
    "1": {
      "name": "NPE Extraction",
      "status": "completed",
      "started_at": "2025-11-22T10:00:00Z",
      "completed_at": "2025-11-22T10:15:00Z",
      "outputs_generated": ["outputs/npe.md"]
    },
    "2": {
      "name": "Dramatic Spine Extraction",
      "status": "completed",
      "started_at": "2025-11-22T12:00:00Z",
      "completed_at": "2025-11-22T12:18:00Z",
      "outputs_generated": ["outputs/dramatic_spine.md"]
    },
    "3": {
      "name": "Theme Extraction",
      "status": "completed",
      "started_at": "2025-11-22T14:30:00Z",
      "completed_at": "2025-11-22T14:42:00Z",
      "outputs_generated": ["outputs/themes.md"]
    },
    "4": {
      "name": "Character Development",
      "status": "completed",
      "started_at": "2025-11-22T16:00:00Z",
      "completed_at": "2025-11-22T16:35:00Z",
      "outputs_generated": [
        "outputs/character_Sarah_Chen.md",
        "outputs/character_Marcus_Drake.md",
        "outputs/character_Elena_Volkov.md"
      ]
    },
    "5": {
      "name": "World Constraints Extraction",
      "status": "in_progress",
      "started_at": "2025-11-22T18:45:00Z"
    },
    "6": {
      "name": "Relationship Mapping",
      "status": "pending"
    },
    "7": {
      "name": "Relationship Architecture",
      "status": "pending"
    },
    "8": {
      "name": "Premise Refinement",
      "status": "pending"
    },
    "9": {
      "name": "Story Outline",
      "status": "pending"
    },
    "10": {
      "name": "NPE Inspection",
      "status": "pending"
    },
    "11": {
      "name": "Outline Rewrite",
      "status": "pending"
    }
  }
}
