{
	"workflow_version": "1.0.0",
	"project_name": "urban-fantasy-romance-v2",
	"current_step": "9",
	"last_updated": "2025-11-23T05:15:00Z",
	"steps": {
		"1": {
			"name": "NPE Extraction",
			"status": "completed",
			"started_at": "2025-11-23T02:00:00Z",
			"completed_at": "2025-11-23T02:15:00Z",
			"outputs_generated": ["outputs/npe.md"]
		},
		"2": {
			"name": "Dramatic Spine Extraction",
			"status": "completed",
			"started_at": "2025-11-23T02:45:00Z",
			"completed_at": "2025-11-23T03:00:00Z",
			"outputs_generated": ["outputs/dramatic_spine.md"]
		},
		"3": {
			"name": "Theme Extraction",
			"status": "completed",
			"started_at": "2025-11-23T03:15:00Z",
			"completed_at": "2025-11-23T03:30:00Z",
			"outputs_generated": ["outputs/themes.md"]
		},
		"4": {
			"name": "Character Development",
			"status": "completed",
			"started_at": "2025-11-23T04:00:00Z",
			"completed_at": "2025-11-23T04:15:00Z",
			"outputs_generated": ["outputs/character_The_Sunshine_Liar.md", "outputs/character_Ash_Nakamura.md"]
		},
		"5": {
			"name": "World Constraints Extraction",
			"status": "completed",
			"started_at": "2025-11-23T04:20:00Z",
			"completed_at": "2025-11-23T04:35:00Z",
			"outputs_generated": ["outputs/world_constraints.md"]
		},
		"6": {
			"name": "Relationship Mapping",
			"status": "completed",
			"started_at": "2025-11-23T04:20:00Z",
			"completed_at": "2025-11-23T04:40:00Z",
			"outputs_generated": ["outputs/relationship_mapping.md"]
		},
		"7": {
			"name": "Relationship Architecture",
			"status": "completed",
			"started_at": "2025-11-23T04:45:00Z",
			"completed_at": "2025-11-23T05:00:00Z",
			"outputs_generated": ["outputs/relationship_Ryn_Ashford_Ash_Nakamura.md"]
		},
		"8": {
			"name": "Premise Refinement",
			"status": "completed",
			"started_at": "2025-11-23T05:05:00Z",
			"completed_at": "2025-11-23T05:15:00Z",
			"outputs_generated": ["outputs/refined_premise.md"]
		},
		"9": {
			"name": "Story Outline",
			"status": "pending"
		},
		"10": {
			"name": "NPE Inspection",
			"status": "pending"
		},
		"11": {
			"name": "Outline Rewrite",
			"status": "pending"
		}
	}
}
