{
  "workflow_version": "1.0.0",
  "project_name": "urban-fantasy-romance-v3",
  "current_step": "7",
  "last_updated": "2025-11-23T07:30:00Z",
  "steps": {
    "1": {
      "name": "NPE Extraction",
      "status": "completed",
      "started_at": "2025-11-23T02:00:00Z",
      "completed_at": "2025-11-23T02:15:00Z",
      "outputs_generated": [
        "outputs/npe.md"
      ]
    },
    "2": {
      "name": "Dramatic Spine Extraction",
      "status": "completed",
      "started_at": "2025-11-23T02:20:00Z",
      "completed_at": "2025-11-23T02:30:00Z",
      "outputs_generated": [
        "outputs/dramatic_spine.md"
      ]
    },
    "3": {
      "name": "Theme Extraction",
      "status": "completed",
      "started_at": "2025-11-23T02:45:00Z",
      "completed_at": "2025-11-23T02:03:46Z",
      "outputs_generated": [
        "outputs/themes.md"
      ]
    },
    "4": {
      "name": "Character Development",
      "status": "completed",
      "started_at": "2025-11-23T02:10:00Z",
      "completed_at": "2025-11-23T02:20:00Z",
      "outputs_generated": [
        "outputs/character_Mara_Chen.md",
        "outputs/character_Kieran_Thorn.md",
        "outputs/character_Riley_Park.md",
        "outputs/character_Lena_Corvus.md",
        "outputs/character_Tobias_Flint.md"
      ]
    },
    "5": {
      "name": "World Constraints Extraction",
      "status": "completed",
      "started_at": "2025-11-23T07:00:00Z",
      "completed_at": "2025-11-23T07:30:00Z",
      "outputs_generated": [
        "outputs/world_constraints.md"
      ]
    },
    "6": {
      "name": "Relationship Mapping",
      "status": "completed",
      "started_at": "2025-11-23T07:00:00Z",
      "completed_at": "2025-11-23T02:43:08Z",
      "outputs_generated": [
        "outputs/relationship_mapping.md"
      ]
    },
    "7": {
      "name": "Relationship Architecture",
      "status": "pending"
    },
    "8": {
      "name": "Premise Refinement",
      "status": "pending"
    },
    "9": {
      "name": "Story Outline",
      "status": "pending"
    },
    "10": {
      "name": "NPE Inspection",
      "status": "pending"
    },
    "11": {
      "name": "Outline Rewrite",
      "status": "pending"
    }
  }
}
