{
  "workflow_version": "1.0.0",
  "project_name": "urban-fantasy-romance-v1",
  "current_step": "10",
  "last_updated": "2025-11-24T00:35:00Z",
  "steps": {
    "1": {"name": "NPE Extraction", "status": "completed", "started_at": "2025-11-23T02:00:00Z", "completed_at": "2025-11-23T02:15:00Z"},
    "2": {"name": "Dramatic Spine Extraction", "status": "completed", "started_at": "2025-11-23T02:30:00Z", "completed_at": "2025-11-23T02:45:00Z"},
    "3": {"name": "Theme Extraction", "status": "completed", "started_at": "2025-11-23T03:00:00Z", "completed_at": "2025-11-23T03:15:00Z"},
    "4": {"name": "Character Development", "status": "completed", "started_at": "2025-11-23T01:37:00Z", "completed_at": "2025-11-23T01:43:00Z"},
    "5": {"name": "World Constraints Extraction", "status": "completed", "started_at": "2025-11-23T02:50:00Z", "completed_at": "2025-11-23T03:05:00Z", "outputs_generated": ["outputs/world_constraints.md"]},
    "6": {"name": "Relationship Mapping", "status": "completed", "started_at": "2025-11-23T02:50:00Z", "completed_at": "2025-11-23T03:05:00Z", "outputs_generated": ["outputs/relationship_mapping.md"]},
    "7": {"name": "Relationship Architecture", "status": "completed", "started_at": "2025-11-23T03:10:00Z", "completed_at": "2025-11-23T03:25:00Z", "outputs_generated": ["outputs/relationship_Kira_Chen_Marcus_Vane.md", "outputs/relationship_Kira_Chen_Captain_Elias_Thorne.md", "outputs/relationship_Kira_Chen_Sarah_Nakamura.md", "outputs/relationship_Marcus_Vane_Sienna_Ashford.md", "outputs/relationship_Kira_Chen_Agent_David_Cross.md"]},
    "8": {"name": "Premise Refinement", "status": "completed", "started_at": "2025-11-23T03:30:00Z", "completed_at": "2025-11-23T03:40:00Z", "outputs_generated": ["outputs/refined_premise.md"]},
    "9": {"name": "Story Outline", "status": "completed", "started_at": "2025-11-24T00:00:00Z", "completed_at": "2025-11-24T00:30:00Z", "outputs_generated": ["outputs/outline.md"]},
    "10": {"name": "NPE Inspection", "status": "in_progress", "started_at": "2025-11-24T00:35:00Z"},
    "11": {"name": "Outline Rewrite", "status": "pending"}
  }
}
